<?xml version="1.0" encoding="UTF-8"?>
<p:Library 
	xmlns:p="http://www.example.org/Library" 
	xmlns:xsi="http://www.w3.org/2001/XMLSchema-instance" 
	xsi:schemaLocation="http://www.example.org/Library ../XSD/library.xsd ">
  <p:name><![CDATA[My Library]]></p:name>
  <p:Writer>
   <p:name>Hector</p:name>
   <p:Book>tutu</p:Book>
   <p:Book>tonton</p:Book> 
  </p:Writer>
  <p:Writer>
   <p:name>Simeon Le Papillon</p:name>
   <p:Book>tutu</p:Book>
   <p:Book>toto</p:Book> 
  </p:Writer>
  <p:Book>
   <p:title>toto</p:title>
   <p:pages>35</p:pages>
   <p:category>Mystery</p:category>
   <p:author>Le Lapin Rose des Alpes</p:author>
  </p:Book>
  <p:Book>
   <p:title>tutu</p:title>
   <p:pages>37</p:pages>
   <p:category>Biography</p:category>
   <p:author>La Poule</p:author>
  </p:Book>
</p:Library>
